{
  "base_sha": "2222222222222222222222222222222222222222",
  "builder_audience": "sigstore",
  "builder_issuer": "https://issuer.example.invalid",
  "builder_subject": "repo:accord:ref:refs/heads/foundation",
  "ci_system": "test",
  "created_at": "2026-07-26T00:00:00Z",
  "protected_environment": "fixture",
  "registry_repository": "registry.example.invalid/accord",
  "remote_ref": "refs/heads/foundation",
  "remote_sha": "1111111111111111111111111111111111111111",
  "remote_url": "ssh://git.example.invalid/accord.git",
  "run_id": "fixture-run-1",
  "schema_version": "1.0.0",
  "tree_sha": "3333333333333333333333333333333333333333",
  "workflow_id": "fixture-workflow-1"
}
